{
  "schema_version": "1.0",
  "source": "deterministic-fixture-source.mp4",
  "language": "en",
  "segments": [
    {"start": 0.0, "end": 1.2, "text": "Start with the buyer question."},
    {"start": 1.2, "end": 2.6, "text": "Show the mechanism and the proof."},
    {"start": 2.6, "end": 4.0, "text": "Finish with the next useful step."}
  ]
}
